### ISSUE TITLE
HTTP request timeout

### ISSUE THREAD

**Issue by YangYongZhi** [reactor/reactor-netty#715]
### [Gitter](https://gitter.im/reactor/reactor) should be used for questions and discussions
I had deployed an application which used reactor-netty into the kubernetes.
and I also have implemented a HTTP service to response for the health checking has been launched by kubelet.
HTTP url : 
-XGET http://[podip]:8080/health

the method for response : 
``` .get("/{firstUrl}", (request, response) -> {
                    String firstUrl = request.param("firstUrl");
                    boolean healthFlag = this.dockerHealthService.isDockerHealthUrl(firstUrl);
                    if (healthFlag) {
                        return response
                            .addHeader(HttpHeaderNames.CONTENT_TYPE.toString(), HttpHeaderValues.APPLICATION_JSON.toString())
                            .send(Mono.just(gson.toJson(HttpResult.success("success", "Check from kubelet")))
                                .compose(StringToByteBufCompose.convertByteBuf()));
                    } 
```

You knows, The kubelet will check this URL regularly (usually every 10 seconds), and most of the response is OK (200), but there still are few failures here, 
The logs of kubelet : 

```
Apr 16 12:50:26 VM_132_2_centos kubelet: I0416 12:50:26.020421    3143 prober.go:111] Readiness probe for "worm-hole-system-api-gz01a-green-645dc59ff5-72njk_dmall-outer(146bac86-5c61-11e9-9413-3e19ed121f09):worm-hole-system-api-0" failed (failure): Get http://10.13.66.182:8080/ready: net/http: request canceled (Client.Timeout exceeded while awaiting headers)

```

But other applications without reactor-netty looks like very well. so How can I find out why does a few connection connect with timeout?

Can anybody help me?
### Reactor Netty version
reactor.version:3.2.8.RELEASE
reactor-netty.version:0.8.6.RELEASE

### JVM version (e.g. `java -version`)
sh-4.2# java -version
cpuinfo : cpuCores = 8
cgroup : cpuQuota = 400000, cpuPeriod = 100000, cpuCores = 4
java version "1.8.0_191"
Java(TM) SE Runtime Environment (build 1.8.0_191-b12)
Java HotSpot(TM) 64-Bit Server VM (build 25.191-b12, mixed mode)

### OS version (e.g. `uname -a`)
Linux worm-hole-system-api-gz01a-green-645dc59ff5-72njk 3.10.0-862.9.1.el7.x86_64 #1 SMP Mon Jul 16 16:29:36 UTC 2018 x86_64 x86_64 x86_64 GNU/Linux

**Comment by YangYongZhi** [comment]
Some Progresses:

In order to find out the reason for the connection timeout,  I add some logs in my application when it received a heath request which launched from Kubelet.

 .get("/{firstUrl}", (request, response) -> {
                   String firstUrl = request.param("firstUrl");
                   LOG.debug("The request launched from kubelet :" + firstUrl);
                   return response
                            .addHeader(HttpHeaderNames.CONTENT_TYPE.toString(), HttpHeaderValues.APPLICATION_JSON.toString())
                            .send(Mono.just(gson.toJson(HttpResult.success("success", "Come from kubelet")))
                                .compose(StringToByteBufCompose.convertByteBuf()));
}

The host IP with the kubelet is : 10.13.82.1
And the application (as a server via reactor-netty) pod's IP is :10.13.82.89 

and I grep this logs file with ''

grep 'The request launched from kubelet' app.log | grep ready | grep '2019-04-16' | grep ' 18:' | awk '{print $3}' | cut -b 1-5 | uniq -c

the output:
      6 17:52
      6 17:53
      6 17:54
      5 17:55
      4 17:56
      3 17:57
      4 17:58
      4 17:59
      4 18:00
      3 18:01
      3 18:02
      3 18:03
      3 18:04
      3 18:05
      3 18:06
      3 18:07
      3 18:08
      3 18:09
     45 18:10
      6 18:11
      6 18:12
      6 18:13
      6 18:14
      6 18:15
      6 18:16
      6 18:17
      6 18:18
      6 18:19
      6 18:20
      6 18:21
      6 18:22
      6 18:23
      6 18:24
      6 18:25
      6 18:26

As you see, you will find that there are more than 6 requests at 18:10 P.M.

but same time I grep the tcp dump file with command 
'grep 'ready' tcpdump.log | grep '18\:''
The output 

18:10:02.812582 IP 10.13.82.1.40788 > 10.13.82.89.8080: Flags [P.], seq 0:119, ack 1, win 229, options [nop,nop,TS val 523695989 ecr 523695988], length 119: HTTP: GET /ready HTTP/1.1
18:10:12.812744 IP 10.13.82.1.40928 > 10.13.82.89.8080: Flags [P.], seq 0:119, ack 1, win 229, options [nop,nop,TS val 523705989 ecr 523705988], length 119: HTTP: GET /ready HTTP/1.1
18:10:22.812593 IP 10.13.82.1.41008 > 10.13.82.89.8080: Flags [P.], seq 0:119, ack 1, win 229, options [nop,nop,TS val 523715989 ecr 523715988], length 119: HTTP: GET /ready HTTP/1.1
18:10:32.812602 IP 10.13.82.1.41078 > 10.13.82.89.8080: Flags [P.], seq 0:119, ack 1, win 229, options [nop,nop,TS val 523725989 ecr 523725988], length 119: HTTP: GET /ready HTTP/1.1
18:10:42.812573 IP 10.13.82.1.41148 > 10.13.82.89.8080: Flags [P.], seq 0:119, ack 1, win 229, options [nop,nop,TS val 523735989 ecr 523735988], length 119: HTTP: GET /ready HTTP/1.1
18:10:52.812544 IP 10.13.82.1.41218 > 10.13.82.89.8080: Flags [P.], seq 0:119, ack 1, win 229, options [nop,nop,TS val 523745988 ecr 523745988], length 119: HTTP: GET /ready HTTP/1.1

you can see, there are only 6 request has been sent from kubelet.

From the above, Too many packets which has been sent by kubelet before 18:10 P.M. has been executed with a latency.

**Comment by YangYongZhi** [comment]
This issue don't relate with react-netty, I find out that this is because of a bug of guava.
The loadingCache has been locked, so that the worker thread of netty has been blocked too.
Sorry.

**Comment by bsideup** [comment]
@YangYongZhi FYI you can try adding http://github.com/reactor/BlockHound to automatically detect blocked threads that should never be blocked
