### ISSUE TITLE
Spring Webclient Read Timeout after being idle for several minutes

### ISSUE THREAD

**Issue by phantomedc** [reactor/reactor-netty#839]
i reproduced this problem in my dev envrionment,I did 4 requests at ```2019-09-06 00:10:14.739```(t1)、```2019-09-06 00:19:51.274```(t2)、```2019-09-06 00:30:37.992```(t3)、```2019-09-06 00:33:13.314```(t4)，
the request1(at t1), request2(at t2)  webclient didn't idle too long time, the requests were processed fine, but request3(at t3), webclient was idle 10minutes, webclient got **Read Timeout**, then i did request4 , it was processed fine as well.
and i noticed that request1、request2、request3，they used same local port: 59838
but request4 used local port:60928

so i guess that: the connection(or channel in netty) will be cached in the connection pool, reactor netty will manage and reuse it, but when the connection idle too long, the connection may be closed or cut down by remote side(F5 loadbalance or Nginx?) or some other reason, it became disconnected on the link layer, but the connection pool did not realize what happened actually, the connection pool still thinks this connection is connected and provide it to webclient, and boom: read time out.
```java
        HttpClient httpClient = HttpClient.create()
                .tcpConfiguration(tcpClient -> {
                    tcpClient = tcpClient.option(ChannelOption.CONNECT_TIMEOUT_MILLIS, 5000);
                    tcpClient = tcpClient.doOnConnected(conn -> conn
                            .addHandlerLast(new ReadTimeoutHandler(15000, TimeUnit.MILLISECONDS)));
                    return tcpClient;
                });
```
request1:
```
2019-09-06 00:10:14.768 [reactor-http-kqueue-5] DEBUG reactor.netty.http.client.HttpClientOperations - [id: 0x0759376f, L:/10.49.3.9:59838 - R:****.com/****:****] Received response (auto-read:false) : [Server=nginx, Date=Thu, 05 Sep 2019 16:10:15 GMT, Content-Type=application/json, Content-Length=64, Connection=keep-alive, Access-Control-Allow-Headers=Accept, Accept-Encoding, Authorization, Content-Type, Origin, Access-Control-Allow-Methods=GET, OPTIONS, Access-Control-Expose-Headers=Date, Vary=Accept-Encoding, Access-Control-Allow-Credentials=true]
2019-09-06 00:10:14.768 [reactor-http-kqueue-5] DEBUG reactor.netty.resources.PooledConnectionProvider - [id: 0x0759376f, L:/10.49.3.9:59838 - R:****.com/****:****] onStateChange(GET{uri=/api/v1/query?time=1567439463&query****), connection=PooledConnection{channel=[id: 0x0759376f, L:/10.49.3.9:59838 - R:****/****:****]}}, [response_received])
2019-09-06 00:10:14.768 [reactor-http-kqueue-5] DEBUG o.s.web.reactive.function.client.ExchangeFunctions - [1807c047] Response 200 OK
```
request2:
```
2019-09-06 00:19:51.272 [reactor-http-kqueue-5] DEBUG reactor.netty.http.client.HttpClientOperations - [id: 0x0759376f, L:/10.49.3.9:59838 - R:****.com/****:****] Received response (auto-read:false) : [Server=nginx, Date=Thu, 05 Sep 2019 16:19:51 GMT, Content-Type=application/json, Content-Length=64, Connection=keep-alive, Access-Control-Allow-Headers=Accept, Accept-Encoding, Authorization, Content-Type, Origin, Access-Control-Allow-Methods=GET, OPTIONS, Access-Control-Expose-Headers=Date, Vary=Accept-Encoding, Access-Control-Allow-Credentials=true]
2019-09-06 00:19:51.272 [reactor-http-kqueue-5] DEBUG reactor.netty.resources.PooledConnectionProvider - [id: 0x0759376f, L:/10.49.3.9:59838 - R:****.com/****:****] onStateChange(GET{uri=/api/v1/query?time=1567439463&query=****), connection=PooledConnection{channel=[id: 0x0759376f, L:/10.49.3.9:59838 - R:****.com/***:***]}}, [response_received])
2019-09-06 00:19:51.272 [reactor-http-kqueue-5] DEBUG o.s.web.reactive.function.client.ExchangeFunctions - [1a576a1] Response 200 OK
```
request3:
```
2019-09-06 00:30:52.998 [reactor-http-kqueue-5] WARN  reactor.netty.http.client.HttpClientConnect - [id: 0x0759376f, L:/10.49.3.9:59838 - R:njyh.data.promes.cloudytrace.com/10.104.232.131:9801] The connection observed an error
io.netty.handler.timeout.ReadTimeoutException: null
	Suppressed: java.lang.Exception: #block terminated with an error
```
request4:
```
2019-09-06 00:33:13.338 [reactor-http-kqueue-3] DEBUG reactor.netty.http.client.HttpClientOperations - [id: 0x47c1f6c3, L:/10.49.3.9:60928 - R:****.com/****:****] Received response (auto-read:false) : [Server=nginx, Date=Thu, 05 Sep 2019 16:33:13 GMT, Content-Type=application/json, Content-Length=64, Connection=keep-alive, Access-Control-Allow-Headers=Accept, Accept-Encoding, Authorization, Content-Type, Origin, Access-Control-Allow-Methods=GET, OPTIONS, Access-Control-Expose-Headers=Date, Vary=Accept-Encoding, Access-Control-Allow-Credentials=true]
2019-09-06 00:33:13.338 [reactor-http-kqueue-3] DEBUG reactor.netty.resources.PooledConnectionProvider - [id: 0x47c1f6c3, L:/10.49.3.9:60928 - R:****.com/****:***] onStateChange(GET{uri=/api/v1/query?time=1567439463&query=****), connection=PooledConnection{channel=[id: 0x47c1f6c3, L:/10.49.3.9:60928 - R:****.com/***:****]}}, [response_received])
2019-09-06 00:33:13.338 [reactor-http-kqueue-3] DEBUG o.s.web.reactive.function.client.ExchangeFunctions - [11c0862d] Response 200 OK
```

sorry for my poor english

**Comment by violetagg** [comment]
@phantomedc Reactor Netty version? Can you take a tcpdump?

**Comment by phantomedc** [comment]
```xml
<groupId>io.projectreactor.netty</groupId>
<artifactId>reactor-netty</artifactId>
<version>0.8.9.RELEASE</version>
```
the first request was processed fine
but the second one read timeout:
```
09:41:32.458238 IP 10.49.3.156.62988 > 10.104.232.131.sstp-2: Flags [P.], seq 2749608877:2749609361, ack 3903359103, win 2050, options [nop,nop,TS val 384850958 ecr 2229265103], length 484
09:41:32.481177 IP 10.49.3.156.62988 > 10.104.232.131.sstp-2: Flags [.], ack 521, win 2042, options [nop,nop,TS val 384850980 ecr 2229426705], length 0
09:41:33.646771 IP 10.49.3.156.62988 > 10.104.232.131.sstp-2: Flags [P.], seq 484:968, ack 521, win 2048, options [nop,nop,TS val 384852122 ecr 2229426705], length 484
09:41:33.670373 IP 10.49.3.156.62988 > 10.104.232.131.sstp-2: Flags [.], ack 1041, win 2039, options [nop,nop,TS val 384852144 ecr 2229427002], length 0
09:41:59.893728 IP 10.49.3.156.62577 > 10.104.232.131.sstp-2: Flags [.], ack 242771583, win 2048, length 0
09:41:59.893780 IP 10.49.3.156.62576 > 10.104.232.131.sstp-2: Flags [.], ack 11664921, win 2048, length 0
09:41:59.894977 IP 10.49.3.156.62574 > 10.104.232.131.sstp-2: Flags [.], ack 3086324703, win 2048, length 0
09:41:59.895020 IP 10.49.3.156.62572 > 10.104.232.131.sstp-2: Flags [.], ack 732920141, win 2048, length 0
09:42:00.006736 IP 10.49.3.156.62582 > 10.104.232.131.sstp-2: Flags [.], ack 2278762315, win 2048, length 0
09:42:00.006773 IP 10.49.3.156.62581 > 10.104.232.131.sstp-2: Flags [.], ack 324117750, win 2048, length 0
09:42:00.006778 IP 10.49.3.156.62578 > 10.104.232.131.sstp-2: Flags [.], ack 3559183719, win 2048, length 0
09:42:00.006792 IP 10.49.3.156.62573 > 10.104.232.131.sstp-2: Flags [.], ack 2203761726, win 2048, length 0
09:42:00.105104 IP 10.49.3.156.62579 > 10.104.232.131.sstp-2: Flags [.], ack 2800781891, win 2048, length 0
09:42:00.324185 IP 10.49.3.156.62580 > 10.104.232.131.sstp-2: Flags [.], ack 747859211, win 2048, length 0
09:42:04.359828 IP 10.49.3.156.62575 > 10.104.232.131.sstp-2: Flags [.], ack 88346093, win 2048, length 0
09:42:45.861830 IP 10.49.3.156.62577 > 10.104.232.131.sstp-2: Flags [.], ack 1, win 2048, length 0
09:42:45.861866 IP 10.49.3.156.62576 > 10.104.232.131.sstp-2: Flags [.], ack 1, win 2048, length 0
09:42:45.863053 IP 10.49.3.156.62574 > 10.104.232.131.sstp-2: Flags [.], ack 1, win 2048, length 0
09:42:45.864231 IP 10.49.3.156.62572 > 10.104.232.131.sstp-2: Flags [.], ack 1, win 2048, length 0
09:42:45.977751 IP 10.49.3.156.62582 > 10.104.232.131.sstp-2: Flags [.], ack 1, win 2048, length 0
09:42:45.977769 IP 10.49.3.156.62581 > 10.104.232.131.sstp-2: Flags [.], ack 1, win 2048, length 0
09:42:45.977773 IP 10.49.3.156.62578 > 10.104.232.131.sstp-2: Flags [.], ack 1, win 2048, length 0
09:42:45.977784 IP 10.49.3.156.62573 > 10.104.232.131.sstp-2: Flags [.], ack 1, win 2048, length 0
09:42:46.073848 IP 10.49.3.156.62579 > 10.104.232.131.sstp-2: Flags [.], ack 1, win 2048, length 0
09:42:46.293702 IP 10.49.3.156.62580 > 10.104.232.131.sstp-2: Flags [.], ack 1, win 2048, length 0
09:42:50.333715 IP 10.49.3.156.62575 > 10.104.232.131.sstp-2: Flags [.], ack 1, win 2048, length 0
09:43:31.964681 IP 10.49.3.156.62577 > 10.104.232.131.sstp-2: Flags [.], ack 1, win 2048, length 0
09:43:31.964791 IP 10.49.3.156.62576 > 10.104.232.131.sstp-2: Flags [.], ack 1, win 2048, length 0
09:43:31.967137 IP 10.49.3.156.62574 > 10.104.232.131.sstp-2: Flags [.], ack 1, win 2048, length 0
09:43:31.967197 IP 10.49.3.156.62572 > 10.104.232.131.sstp-2: Flags [.], ack 1, win 2048, length 0
09:43:32.078298 IP 10.49.3.156.62582 > 10.104.232.131.sstp-2: Flags [.], ack 1, win 2048, length 0
09:43:32.078357 IP 10.49.3.156.62581 > 10.104.232.131.sstp-2: Flags [.], ack 1, win 2048, length 0
09:43:32.078363 IP 10.49.3.156.62578 > 10.104.232.131.sstp-2: Flags [.], ack 1, win 2048, length 0
09:43:32.078369 IP 10.49.3.156.62573 > 10.104.232.131.sstp-2: Flags [.], ack 1, win 2048, length 0
09:43:32.176600 IP 10.49.3.156.62579 > 10.104.232.131.sstp-2: Flags [.], ack 1, win 2048, length 0
09:43:32.398818 IP 10.49.3.156.62580 > 10.104.232.131.sstp-2: Flags [.], ack 1, win 2048, length 0
09:43:36.439734 IP 10.49.3.156.62575 > 10.104.232.131.sstp-2: Flags [.], ack 1, win 2048, length 0
09:44:17.746197 IP 10.49.3.156.62577 > 10.104.232.131.sstp-2: Flags [.], ack 1, win 2048, length 0
09:44:17.746240 IP 10.49.3.156.62576 > 10.104.232.131.sstp-2: Flags [.], ack 1, win 2048, length 0
09:44:17.748560 IP 10.49.3.156.62574 > 10.104.232.131.sstp-2: Flags [.], ack 1, win 2048, length 0
09:44:17.748605 IP 10.49.3.156.62572 > 10.104.232.131.sstp-2: Flags [.], ack 1, win 2048, length 0
09:44:17.859703 IP 10.49.3.156.62582 > 10.104.232.131.sstp-2: Flags [.], ack 1, win 2048, length 0
09:44:17.859760 IP 10.49.3.156.62581 > 10.104.232.131.sstp-2: Flags [.], ack 1, win 2048, length 0
09:44:17.859790 IP 10.49.3.156.62578 > 10.104.232.131.sstp-2: Flags [.], ack 1, win 2048, length 0
09:44:17.859803 IP 10.49.3.156.62573 > 10.104.232.131.sstp-2: Flags [.], ack 1, win 2048, length 0
09:44:17.958206 IP 10.49.3.156.62579 > 10.104.232.131.sstp-2: Flags [.], ack 1, win 2048, length 0
09:44:18.180105 IP 10.49.3.156.62580 > 10.104.232.131.sstp-2: Flags [.], ack 1, win 2048, length 0
09:44:22.217692 IP 10.49.3.156.62575 > 10.104.232.131.sstp-2: Flags [.], ack 1, win 2048, length 0
09:45:03.515056 IP 10.49.3.156.62577 > 10.104.232.131.sstp-2: Flags [.], ack 1, win 2048, length 0
09:45:03.515110 IP 10.49.3.156.62576 > 10.104.232.131.sstp-2: Flags [.], ack 1, win 2048, length 0
09:45:03.517224 IP 10.49.3.156.62574 > 10.104.232.131.sstp-2: Flags [.], ack 1, win 2048, length 0
09:45:03.517273 IP 10.49.3.156.62572 > 10.104.232.131.sstp-2: Flags [.], ack 1, win 2048, length 0
09:45:03.631843 IP 10.49.3.156.62582 > 10.104.232.131.sstp-2: Flags [.], ack 1, win 2048, length 0
09:45:03.631903 IP 10.49.3.156.62581 > 10.104.232.131.sstp-2: Flags [.], ack 1, win 2048, length 0
09:45:03.631910 IP 10.49.3.156.62578 > 10.104.232.131.sstp-2: Flags [.], ack 1, win 2048, length 0
09:45:03.631916 IP 10.49.3.156.62573 > 10.104.232.131.sstp-2: Flags [.], ack 1, win 2048, length 0
09:45:03.728586 IP 10.49.3.156.62579 > 10.104.232.131.sstp-2: Flags [.], ack 1, win 2048, length 0
09:45:03.954960 IP 10.49.3.156.62580 > 10.104.232.131.sstp-2: Flags [.], ack 1, win 2048, length 0
09:45:08.023186 IP 10.49.3.156.62575 > 10.104.232.131.sstp-2: Flags [.], ack 1, win 2048, length 0
09:45:49.332481 IP 10.49.3.156.62577 > 10.104.232.131.sstp-2: Flags [.], ack 1, win 2048, length 0
09:45:49.334577 IP 10.49.3.156.62576 > 10.104.232.131.sstp-2: Flags [.], ack 1, win 2048, length 0
09:45:49.335802 IP 10.49.3.156.62574 > 10.104.232.131.sstp-2: Flags [.], ack 1, win 2048, length 0
09:45:49.337084 IP 10.49.3.156.62572 > 10.104.232.131.sstp-2: Flags [.], ack 1, win 2048, length 0
09:45:49.450496 IP 10.49.3.156.62582 > 10.104.232.131.sstp-2: Flags [.], ack 1, win 2048, length 0
09:45:49.450555 IP 10.49.3.156.62581 > 10.104.232.131.sstp-2: Flags [.], ack 1, win 2048, length 0
09:45:49.450562 IP 10.49.3.156.62573 > 10.104.232.131.sstp-2: Flags [.], ack 1, win 2048, length 0
09:45:49.454015 IP 10.49.3.156.62578 > 10.104.232.131.sstp-2: Flags [.], ack 1, win 2048, length 0
09:45:49.546663 IP 10.49.3.156.62579 > 10.104.232.131.sstp-2: Flags [.], ack 1, win 2048, length 0
09:45:49.769457 IP 10.49.3.156.62580 > 10.104.232.131.sstp-2: Flags [.], ack 1, win 2048, length 0
09:45:53.796269 IP 10.49.3.156.62575 > 10.104.232.131.sstp-2: Flags [.], ack 1, win 2048, length 0
09:46:35.217380 IP 10.49.3.156.62577 > 10.104.232.131.sstp-2: Flags [.], ack 1, win 2048, length 0
09:46:35.217393 IP 10.49.3.156.62576 > 10.104.232.131.sstp-2: Flags [.], ack 1, win 2048, length 0
09:46:35.217399 IP 10.49.3.156.62574 > 10.104.232.131.sstp-2: Flags [.], ack 1, win 2048, length 0
09:46:35.217406 IP 10.49.3.156.62572 > 10.104.232.131.sstp-2: Flags [.], ack 1, win 2048, length 0
09:46:35.329752 IP 10.49.3.156.62582 > 10.104.232.131.sstp-2: Flags [.], ack 1, win 2048, length 0
09:46:35.329811 IP 10.49.3.156.62581 > 10.104.232.131.sstp-2: Flags [.], ack 1, win 2048, length 0
09:46:35.329818 IP 10.49.3.156.62578 > 10.104.232.131.sstp-2: Flags [.], ack 1, win 2048, length 0
09:46:35.329824 IP 10.49.3.156.62573 > 10.104.232.131.sstp-2: Flags [.], ack 1, win 2048, length 0
09:46:35.352586 IP 10.49.3.156.62579 > 10.104.232.131.sstp-2: Flags [.], ack 1, win 2048, length 0
09:46:35.564452 IP 10.49.3.156.62580 > 10.104.232.131.sstp-2: Flags [.], ack 1, win 2048, length 0
09:46:39.613068 IP 10.49.3.156.62575 > 10.104.232.131.sstp-2: Flags [.], ack 1, win 2048, length 0
09:47:21.092077 IP 10.49.3.156.62577 > 10.104.232.131.sstp-2: Flags [.], ack 1, win 2048, length 0
09:47:21.092148 IP 10.49.3.156.62576 > 10.104.232.131.sstp-2: Flags [.], ack 1, win 2048, length 0
09:47:21.092161 IP 10.49.3.156.62574 > 10.104.232.131.sstp-2: Flags [.], ack 1, win 2048, length 0
09:47:21.092167 IP 10.49.3.156.62572 > 10.104.232.131.sstp-2: Flags [.], ack 1, win 2048, length 0
09:47:21.193252 IP 10.49.3.156.62582 > 10.104.232.131.sstp-2: Flags [.], ack 1, win 2048, length 0
09:47:21.193353 IP 10.49.3.156.62581 > 10.104.232.131.sstp-2: Flags [.], ack 1, win 2048, length 0
09:47:21.193362 IP 10.49.3.156.62579 > 10.104.232.131.sstp-2: Flags [.], ack 1, win 2048, length 0
09:47:21.193368 IP 10.49.3.156.62578 > 10.104.232.131.sstp-2: Flags [.], ack 1, win 2048, length 0
09:47:21.193375 IP 10.49.3.156.62573 > 10.104.232.131.sstp-2: Flags [.], ack 1, win 2048, length 0
09:47:21.411549 IP 10.49.3.156.62580 > 10.104.232.131.sstp-2: Flags [.], ack 1, win 2048, length 0
09:47:25.408011 IP 10.49.3.156.62575 > 10.104.232.131.sstp-2: Flags [.], ack 1, win 2048, length 0
09:48:06.869541 IP 10.49.3.156.62577 > 10.104.232.131.sstp-2: Flags [.], ack 1, win 2048, length 0
09:48:06.869601 IP 10.49.3.156.62576 > 10.104.232.131.sstp-2: Flags [.], ack 1, win 2048, length 0
09:48:06.869608 IP 10.49.3.156.62574 > 10.104.232.131.sstp-2: Flags [.], ack 1, win 2048, length 0
09:48:06.869614 IP 10.49.3.156.62572 > 10.104.232.131.sstp-2: Flags [.], ack 1, win 2048, length 0
09:48:06.972875 IP 10.49.3.156.62582 > 10.104.232.131.sstp-2: Flags [.], ack 1, win 2048, length 0
09:48:06.972934 IP 10.49.3.156.62581 > 10.104.232.131.sstp-2: Flags [.], ack 1, win 2048, length 0
09:48:06.972941 IP 10.49.3.156.62579 > 10.104.232.131.sstp-2: Flags [.], ack 1, win 2048, length 0
09:48:06.972946 IP 10.49.3.156.62578 > 10.104.232.131.sstp-2: Flags [.], ack 1, win 2048, length 0
09:48:06.972952 IP 10.49.3.156.62573 > 10.104.232.131.sstp-2: Flags [.], ack 1, win 2048, length 0
09:48:07.191225 IP 10.49.3.156.62580 > 10.104.232.131.sstp-2: Flags [.], ack 1, win 2048, length 0
09:48:11.175645 IP 10.49.3.156.62575 > 10.104.232.131.sstp-2: Flags [.], ack 1, win 2048, length 0
09:48:52.608267 IP 10.49.3.156.62577 > 10.104.232.131.sstp-2: Flags [.], ack 1, win 2048, length 0
09:48:52.608325 IP 10.49.3.156.62576 > 10.104.232.131.sstp-2: Flags [.], ack 1, win 2048, length 0
09:48:52.608331 IP 10.49.3.156.62574 > 10.104.232.131.sstp-2: Flags [.], ack 1, win 2048, length 0
09:48:52.608337 IP 10.49.3.156.62572 > 10.104.232.131.sstp-2: Flags [.], ack 1, win 2048, length 0
09:48:52.784464 IP 10.49.3.156.62582 > 10.104.232.131.sstp-2: Flags [.], ack 1, win 2048, length 0
09:48:52.784507 IP 10.49.3.156.62581 > 10.104.232.131.sstp-2: Flags [.], ack 1, win 2048, length 0
09:48:52.784524 IP 10.49.3.156.62579 > 10.104.232.131.sstp-2: Flags [.], ack 1, win 2048, length 0
09:48:52.784528 IP 10.49.3.156.62578 > 10.104.232.131.sstp-2: Flags [.], ack 1, win 2048, length 0
09:48:52.784532 IP 10.49.3.156.62573 > 10.104.232.131.sstp-2: Flags [.], ack 1, win 2048, length 0
09:48:52.960752 IP 10.49.3.156.62580 > 10.104.232.131.sstp-2: Flags [.], ack 1, win 2048, length 0
09:48:57.013721 IP 10.49.3.156.62575 > 10.104.232.131.sstp-2: Flags [.], ack 1, win 2048, length 0
09:49:38.433891 IP 10.49.3.156.62577 > 10.104.232.131.sstp-2: Flags [.], ack 1, win 2048, length 0
09:49:38.433949 IP 10.49.3.156.62576 > 10.104.232.131.sstp-2: Flags [.], ack 1, win 2048, length 0
09:49:38.433955 IP 10.49.3.156.62574 > 10.104.232.131.sstp-2: Flags [.], ack 1, win 2048, length 0
09:49:38.433961 IP 10.49.3.156.62572 > 10.104.232.131.sstp-2: Flags [.], ack 1, win 2048, length 0
09:49:38.648040 IP 10.49.3.156.62582 > 10.104.232.131.sstp-2: Flags [.], ack 1, win 2048, length 0
09:49:38.648098 IP 10.49.3.156.62581 > 10.104.232.131.sstp-2: Flags [.], ack 1, win 2048, length 0
09:49:38.648104 IP 10.49.3.156.62579 > 10.104.232.131.sstp-2: Flags [.], ack 1, win 2048, length 0
09:49:38.648110 IP 10.49.3.156.62578 > 10.104.232.131.sstp-2: Flags [.], ack 1, win 2048, length 0
09:49:38.648116 IP 10.49.3.156.62573 > 10.104.232.131.sstp-2: Flags [.], ack 1, win 2048, length 0
09:49:38.748972 IP 10.49.3.156.62580 > 10.104.232.131.sstp-2: Flags [.], ack 1, win 2048, length 0
09:49:42.836128 IP 10.49.3.156.62575 > 10.104.232.131.sstp-2: Flags [.], ack 1, win 2048, length 0
09:50:24.212828 IP 10.49.3.156.62577 > 10.104.232.131.sstp-2: Flags [.], ack 1, win 2048, length 0
09:50:24.212861 IP 10.49.3.156.62576 > 10.104.232.131.sstp-2: Flags [.], ack 1, win 2048, length 0
09:50:24.212864 IP 10.49.3.156.62574 > 10.104.232.131.sstp-2: Flags [.], ack 1, win 2048, length 0
09:50:24.212867 IP 10.49.3.156.62572 > 10.104.232.131.sstp-2: Flags [.], ack 1, win 2048, length 0
09:50:24.428840 IP 10.49.3.156.62582 > 10.104.232.131.sstp-2: Flags [.], ack 1, win 2048, length 0
09:50:24.428971 IP 10.49.3.156.62581 > 10.104.232.131.sstp-2: Flags [.], ack 1, win 2048, length 0
09:50:24.428981 IP 10.49.3.156.62579 > 10.104.232.131.sstp-2: Flags [.], ack 1, win 2048, length 0
09:50:24.428989 IP 10.49.3.156.62578 > 10.104.232.131.sstp-2: Flags [.], ack 1, win 2048, length 0
09:50:24.429001 IP 10.49.3.156.62573 > 10.104.232.131.sstp-2: Flags [.], ack 1, win 2048, length 0
09:50:24.529735 IP 10.49.3.156.62580 > 10.104.232.131.sstp-2: Flags [.], ack 1, win 2048, length 0
09:50:28.602192 IP 10.49.3.156.62575 > 10.104.232.131.sstp-2: Flags [.], ack 1, win 2048, length 0
09:51:09.999240 IP 10.49.3.156.62577 > 10.104.232.131.sstp-2: Flags [.], ack 1, win 2048, length 0
09:51:09.999298 IP 10.49.3.156.62576 > 10.104.232.131.sstp-2: Flags [.], ack 1, win 2048, length 0
09:51:09.999305 IP 10.49.3.156.62574 > 10.104.232.131.sstp-2: Flags [.], ack 1, win 2048, length 0
09:51:09.999311 IP 10.49.3.156.62572 > 10.104.232.131.sstp-2: Flags [.], ack 1, win 2048, length 0
09:51:10.221898 IP 10.49.3.156.62582 > 10.104.232.131.sstp-2: Flags [.], ack 1, win 2048, length 0
09:51:10.221986 IP 10.49.3.156.62581 > 10.104.232.131.sstp-2: Flags [.], ack 1, win 2048, length 0
09:51:10.221993 IP 10.49.3.156.62579 > 10.104.232.131.sstp-2: Flags [.], ack 1, win 2048, length 0
09:51:10.221999 IP 10.49.3.156.62578 > 10.104.232.131.sstp-2: Flags [.], ack 1, win 2048, length 0
09:51:10.222005 IP 10.49.3.156.62573 > 10.104.232.131.sstp-2: Flags [.], ack 1, win 2048, length 0
09:51:10.322674 IP 10.49.3.156.62580 > 10.104.232.131.sstp-2: Flags [.], ack 1, win 2048, length 0
09:51:14.411878 IP 10.49.3.156.62575 > 10.104.232.131.sstp-2: Flags [.], ack 1, win 2048, length 0
09:51:55.864314 IP 10.49.3.156.62577 > 10.104.232.131.sstp-2: Flags [.], ack 1, win 2048, length 0
09:51:55.864397 IP 10.49.3.156.62576 > 10.104.232.131.sstp-2: Flags [.], ack 1, win 2048, length 0
09:51:55.864405 IP 10.49.3.156.62574 > 10.104.232.131.sstp-2: Flags [.], ack 1, win 2048, length 0
09:51:55.864411 IP 10.49.3.156.62572 > 10.104.232.131.sstp-2: Flags [.], ack 1, win 2048, length 0
09:51:56.080606 IP 10.49.3.156.62582 > 10.104.232.131.sstp-2: Flags [.], ack 1, win 2048, length 0
09:51:56.081720 IP 10.49.3.156.62581 > 10.104.232.131.sstp-2: Flags [.], ack 1, win 2048, length 0
09:51:56.081742 IP 10.49.3.156.62579 > 10.104.232.131.sstp-2: Flags [.], ack 1, win 2048, length 0
09:51:56.081747 IP 10.49.3.156.62578 > 10.104.232.131.sstp-2: Flags [.], ack 1, win 2048, length 0
09:51:56.081764 IP 10.49.3.156.62573 > 10.104.232.131.sstp-2: Flags [.], ack 1, win 2048, length 0
09:51:56.181693 IP 10.49.3.156.62580 > 10.104.232.131.sstp-2: Flags [.], ack 1, win 2048, length 0
09:52:00.270831 IP 10.49.3.156.62575 > 10.104.232.131.sstp-2: Flags [.], ack 1, win 2048, length 0
09:52:41.693363 IP 10.49.3.156.62577 > 10.104.232.131.sstp-2: Flags [.], ack 1, win 2048, length 0
09:52:41.693397 IP 10.49.3.156.62576 > 10.104.232.131.sstp-2: Flags [.], ack 1, win 2048, length 0
09:52:41.693402 IP 10.49.3.156.62574 > 10.104.232.131.sstp-2: Flags [.], ack 1, win 2048, length 0
09:52:41.693407 IP 10.49.3.156.62572 > 10.104.232.131.sstp-2: Flags [.], ack 1, win 2048, length 0
09:52:41.906805 IP 10.49.3.156.62582 > 10.104.232.131.sstp-2: Flags [.], ack 1, win 2048, length 0
09:52:41.906848 IP 10.49.3.156.62581 > 10.104.232.131.sstp-2: Flags [.], ack 1, win 2048, length 0
09:52:41.906857 IP 10.49.3.156.62578 > 10.104.232.131.sstp-2: Flags [.], ack 1, win 2048, length 0
09:52:41.908041 IP 10.49.3.156.62579 > 10.104.232.131.sstp-2: Flags [.], ack 1, win 2048, length 0
09:52:41.908085 IP 10.49.3.156.62573 > 10.104.232.131.sstp-2: Flags [.], ack 1, win 2048, length 0
09:52:42.008917 IP 10.49.3.156.62580 > 10.104.232.131.sstp-2: Flags [.], ack 1, win 2048, length 0
09:52:46.079490 IP 10.49.3.156.62575 > 10.104.232.131.sstp-2: Flags [.], ack 1, win 2048, length 0
09:53:27.455785 IP 10.49.3.156.62577 > 10.104.232.131.sstp-2: Flags [.], ack 1, win 2048, length 0
09:53:27.455843 IP 10.49.3.156.62576 > 10.104.232.131.sstp-2: Flags [.], ack 1, win 2048, length 0
09:53:27.455849 IP 10.49.3.156.62574 > 10.104.232.131.sstp-2: Flags [.], ack 1, win 2048, length 0
09:53:27.455855 IP 10.49.3.156.62572 > 10.104.232.131.sstp-2: Flags [.], ack 1, win 2048, length 0
09:53:27.715735 IP 10.49.3.156.62582 > 10.104.232.131.sstp-2: Flags [.], ack 1, win 2048, length 0
09:53:27.715793 IP 10.49.3.156.62581 > 10.104.232.131.sstp-2: Flags [.], ack 1, win 2048, length 0
09:53:27.715822 IP 10.49.3.156.62579 > 10.104.232.131.sstp-2: Flags [.], ack 1, win 2048, length 0
09:53:27.715828 IP 10.49.3.156.62578 > 10.104.232.131.sstp-2: Flags [.], ack 1, win 2048, length 0
09:53:27.715841 IP 10.49.3.156.62573 > 10.104.232.131.sstp-2: Flags [.], ack 1, win 2048, length 0
09:53:27.861716 IP 10.49.3.156.62580 > 10.104.232.131.sstp-2: Flags [.], ack 1, win 2048, length 0
09:53:31.868777 IP 10.49.3.156.62575 > 10.104.232.131.sstp-2: Flags [.], ack 1, win 2048, length 0
09:54:13.261705 IP 10.49.3.156.62577 > 10.104.232.131.sstp-2: Flags [.], ack 1, win 2048, length 0
09:54:13.261787 IP 10.49.3.156.62576 > 10.104.232.131.sstp-2: Flags [.], ack 1, win 2048, length 0
09:54:13.261794 IP 10.49.3.156.62574 > 10.104.232.131.sstp-2: Flags [.], ack 1, win 2048, length 0
09:54:13.261800 IP 10.49.3.156.62572 > 10.104.232.131.sstp-2: Flags [.], ack 1, win 2048, length 0
09:54:13.484671 IP 10.49.3.156.62582 > 10.104.232.131.sstp-2: Flags [.], ack 1, win 2048, length 0
09:54:13.484731 IP 10.49.3.156.62581 > 10.104.232.131.sstp-2: Flags [.], ack 1, win 2048, length 0
09:54:13.484755 IP 10.49.3.156.62579 > 10.104.232.131.sstp-2: Flags [.], ack 1, win 2048, length 0
09:54:13.484761 IP 10.49.3.156.62578 > 10.104.232.131.sstp-2: Flags [.], ack 1, win 2048, length 0
09:54:13.484774 IP 10.49.3.156.62573 > 10.104.232.131.sstp-2: Flags [.], ack 1, win 2048, length 0
09:54:13.697704 IP 10.49.3.156.62580 > 10.104.232.131.sstp-2: Flags [.], ack 1, win 2048, length 0
09:54:17.611684 IP 10.49.3.156.62575 > 10.104.232.131.sstp-2: Flags [.], ack 1, win 2048, length 0
09:54:59.011536 IP 10.49.3.156.62577 > 10.104.232.131.sstp-2: Flags [.], ack 1, win 2048, length 0
09:54:59.011579 IP 10.49.3.156.62576 > 10.104.232.131.sstp-2: Flags [.], ack 1, win 2048, length 0
09:54:59.011584 IP 10.49.3.156.62574 > 10.104.232.131.sstp-2: Flags [.], ack 1, win 2048, length 0
09:54:59.011588 IP 10.49.3.156.62572 > 10.104.232.131.sstp-2: Flags [.], ack 1, win 2048, length 0
09:54:59.236957 IP 10.49.3.156.62582 > 10.104.232.131.sstp-2: Flags [.], ack 1, win 2048, length 0
09:54:59.238183 IP 10.49.3.156.62581 > 10.104.232.131.sstp-2: Flags [.], ack 1, win 2048, length 0
09:54:59.238226 IP 10.49.3.156.62579 > 10.104.232.131.sstp-2: Flags [.], ack 1, win 2048, length 0
09:54:59.238230 IP 10.49.3.156.62578 > 10.104.232.131.sstp-2: Flags [.], ack 1, win 2048, length 0
09:54:59.238234 IP 10.49.3.156.62573 > 10.104.232.131.sstp-2: Flags [.], ack 1, win 2048, length 0
09:54:59.452739 IP 10.49.3.156.62580 > 10.104.232.131.sstp-2: Flags [.], ack 1, win 2048, length 0
09:55:03.368646 IP 10.49.3.156.62575 > 10.104.232.131.sstp-2: Flags [.], ack 1, win 2048, length 0
09:55:44.781513 IP 10.49.3.156.62577 > 10.104.232.131.sstp-2: Flags [.], ack 1, win 2048, length 0
09:55:44.781585 IP 10.49.3.156.62576 > 10.104.232.131.sstp-2: Flags [.], ack 1, win 2048, length 0
09:55:44.781592 IP 10.49.3.156.62574 > 10.104.232.131.sstp-2: Flags [.], ack 1, win 2048, length 0
09:55:44.781599 IP 10.49.3.156.62572 > 10.104.232.131.sstp-2: Flags [.], ack 1, win 2048, length 0
09:55:44.999870 IP 10.49.3.156.62582 > 10.104.232.131.sstp-2: Flags [.], ack 1, win 2048, length 0
09:55:45.001112 IP 10.49.3.156.62579 > 10.104.232.131.sstp-2: Flags [.], ack 1, win 2048, length 0
09:55:45.001171 IP 10.49.3.156.62578 > 10.104.232.131.sstp-2: Flags [.], ack 1, win 2048, length 0
09:55:45.001177 IP 10.49.3.156.62573 > 10.104.232.131.sstp-2: Flags [.], ack 1, win 2048, length 0
09:55:45.002241 IP 10.49.3.156.62581 > 10.104.232.131.sstp-2: Flags [.], ack 1, win 2048, length 0
09:55:45.217891 IP 10.49.3.156.62580 > 10.104.232.131.sstp-2: Flags [.], ack 1, win 2048, length 0
09:55:49.131564 IP 10.49.3.156.62575 > 10.104.232.131.sstp-2: Flags [.], ack 1, win 2048, length 0
09:56:30.524546 IP 10.49.3.156.62577 > 10.104.232.131.sstp-2: Flags [.], ack 1, win 2048, length 0
09:56:30.524574 IP 10.49.3.156.62576 > 10.104.232.131.sstp-2: Flags [.], ack 1, win 2048, length 0
09:56:30.524587 IP 10.49.3.156.62574 > 10.104.232.131.sstp-2: Flags [.], ack 1, win 2048, length 0
09:56:30.524594 IP 10.49.3.156.62572 > 10.104.232.131.sstp-2: Flags [.], ack 1, win 2048, length 0
09:56:30.747513 IP 10.49.3.156.62582 > 10.104.232.131.sstp-2: Flags [.], ack 1, win 2048, length 0
09:56:30.749939 IP 10.49.3.156.62579 > 10.104.232.131.sstp-2: Flags [.], ack 1, win 2048, length 0
09:56:30.750000 IP 10.49.3.156.62578 > 10.104.232.131.sstp-2: Flags [.], ack 1, win 2048, length 0
09:56:30.750016 IP 10.49.3.156.62573 > 10.104.232.131.sstp-2: Flags [.], ack 1, win 2048, length 0
09:56:30.751064 IP 10.49.3.156.62581 > 10.104.232.131.sstp-2: Flags [.], ack 1, win 2048, length 0
09:56:30.967548 IP 10.49.3.156.62580 > 10.104.232.131.sstp-2: Flags [.], ack 1, win 2048, length 0
09:56:34.880718 IP 10.49.3.156.62575 > 10.104.232.131.sstp-2: Flags [.], ack 1, win 2048, length 0
09:57:16.346378 IP 10.49.3.156.62577 > 10.104.232.131.sstp-2: Flags [.], ack 1, win 2048, length 0
09:57:16.346439 IP 10.49.3.156.62576 > 10.104.232.131.sstp-2: Flags [.], ack 1, win 2048, length 0
09:57:16.346446 IP 10.49.3.156.62574 > 10.104.232.131.sstp-2: Flags [.], ack 1, win 2048, length 0
09:57:16.346452 IP 10.49.3.156.62572 > 10.104.232.131.sstp-2: Flags [.], ack 1, win 2048, length 0
09:57:16.570526 IP 10.49.3.156.62582 > 10.104.232.131.sstp-2: Flags [.], ack 1, win 2048, length 0
09:57:16.572707 IP 10.49.3.156.62581 > 10.104.232.131.sstp-2: Flags [.], ack 1, win 2048, length 0
09:57:16.572739 IP 10.49.3.156.62579 > 10.104.232.131.sstp-2: Flags [.], ack 1, win 2048, length 0
09:57:16.572760 IP 10.49.3.156.62578 > 10.104.232.131.sstp-2: Flags [.], ack 1, win 2048, length 0
09:57:16.572766 IP 10.49.3.156.62573 > 10.104.232.131.sstp-2: Flags [.], ack 1, win 2048, length 0
09:57:16.786539 IP 10.49.3.156.62580 > 10.104.232.131.sstp-2: Flags [.], ack 1, win 2048, length 0
09:57:20.708391 IP 10.49.3.156.62575 > 10.104.232.131.sstp-2: Flags [.], ack 1, win 2048, length 0
09:57:44.717831 IP 10.49.3.156.62988 > 10.104.232.131.sstp-2: Flags [P.], seq 968:1452, ack 1041, win 2048, options [nop,nop,TS val 385806053 ecr 2229427002], length 484
09:57:44.812677 IP 10.49.3.156.62988 > 10.104.232.131.sstp-2: Flags [P.], seq 968:1452, ack 1041, win 2048, options [nop,nop,TS val 385806146 ecr 2229427002], length 484
09:57:45.078512 IP 10.49.3.156.62988 > 10.104.232.131.sstp-2: Flags [P.], seq 968:1452, ack 1041, win 2048, options [nop,nop,TS val 385806408 ecr 2229427002], length 484
09:57:45.409400 IP 10.49.3.156.62988 > 10.104.232.131.sstp-2: Flags [P.], seq 968:1452, ack 1041, win 2048, options [nop,nop,TS val 385806732 ecr 2229427002], length 484
09:57:45.865745 IP 10.49.3.156.62988 > 10.104.232.131.sstp-2: Flags [P.], seq 968:1452, ack 1041, win 2048, options [nop,nop,TS val 385807180 ecr 2229427002], length 484
09:57:46.578869 IP 10.49.3.156.62988 > 10.104.232.131.sstp-2: Flags [P.], seq 968:1452, ack 1041, win 2048, options [nop,nop,TS val 385807876 ecr 2229427002], length 484
09:57:47.786491 IP 10.49.3.156.62988 > 10.104.232.131.sstp-2: Flags [P.], seq 968:1452, ack 1041, win 2048, options [nop,nop,TS val 385809068 ecr 2229427002], length 484
09:57:49.680971 IP 10.49.3.156.62988 > 10.104.232.131.sstp-2: Flags [P.], seq 968:1452, ack 1041, win 2048, options [nop,nop,TS val 385810932 ecr 2229427002], length 484
09:57:53.265728 IP 10.49.3.156.62988 > 10.104.232.131.sstp-2: Flags [P.], seq 968:1452, ack 1041, win 2048, options [nop,nop,TS val 385814460 ecr 2229427002], length 484
09:57:56.844957 IP 10.49.3.156.62988 > 10.104.232.131.sstp-2: Flags [P.], seq 968:1452, ack 1041, win 2048, options [nop,nop,TS val 385817988 ecr 2229427002], length 484
09:57:59.724091 IP 10.49.3.156.62988 > 10.104.232.131.sstp-2: Flags [F.], seq 1452, ack 1041, win 2048, options [nop,nop,TS val 385820823 ecr 2229427002], length 0
09:58:00.429858 IP 10.49.3.156.62988 > 10.104.232.131.sstp-2: Flags [FP.], seq 968:1452, ack 1041, win 2048, options [nop,nop,TS val 385821516 ecr 2229427002], length 484
09:58:02.145483 IP 10.49.3.156.62577 > 10.104.232.131.sstp-2: Flags [.], ack 1, win 2048, length 0
09:58:02.145545 IP 10.49.3.156.62576 > 10.104.232.131.sstp-2: Flags [.], ack 1, win 2048, length 0
09:58:02.145561 IP 10.49.3.156.62574 > 10.104.232.131.sstp-2: Flags [.], ack 1, win 2048, length 0
09:58:02.145566 IP 10.49.3.156.62572 > 10.104.232.131.sstp-2: Flags [.], ack 1, win 2048, length 0
09:58:02.364934 IP 10.49.3.156.62582 > 10.104.232.131.sstp-2: Flags [.], ack 1, win 2048, length 0
09:58:02.366071 IP 10.49.3.156.62581 > 10.104.232.131.sstp-2: Flags [.], ack 1, win 2048, length 0
09:58:02.366101 IP 10.49.3.156.62578 > 10.104.232.131.sstp-2: Flags [.], ack 1, win 2048, length 0
09:58:02.366117 IP 10.49.3.156.62573 > 10.104.232.131.sstp-2: Flags [.], ack 1, win 2048, length 0
09:58:02.367318 IP 10.49.3.156.62579 > 10.104.232.131.sstp-2: Flags [.], ack 1, win 2048, length 0
09:58:02.582513 IP 10.49.3.156.62580 > 10.104.232.131.sstp-2: Flags [.], ack 1, win 2048, length 0
09:58:04.026552 IP 10.49.3.156.62988 > 10.104.232.131.sstp-2: Flags [FP.], seq 968:1452, ack 1041, win 2048, options [nop,nop,TS val 385825044 ecr 2229427002], length 484
09:58:06.504836 IP 10.49.3.156.62575 > 10.104.232.131.sstp-2: Flags [.], ack 1, win 2048, length 0
09:58:07.622889 IP 10.49.3.156.62988 > 10.104.232.131.sstp-2: Flags [FP.], seq 968:1452, ack 1041, win 2048, options [nop,nop,TS val 385828572 ecr 2229427002], length 484
09:58:11.204119 IP 10.49.3.156.62988 > 10.104.232.131.sstp-2: Flags [FP.], seq 968:1452, ack 1041, win 2048, options [nop,nop,TS val 385832100 ecr 2229427002], length 484
09:58:14.795775 IP 10.49.3.156.62988 > 10.104.232.131.sstp-2: Flags [R.], seq 1453, ack 1041, win 2048, length 0
09:58:47.940457 IP 10.49.3.156.62577 > 10.104.232.131.sstp-2: Flags [.], ack 1, win 2048, length 0
09:58:47.940526 IP 10.49.3.156.62576 > 10.104.232.131.sstp-2: Flags [.], ack 1, win 2048, length 0
09:58:47.940533 IP 10.49.3.156.62574 > 10.104.232.131.sstp-2: Flags [.], ack 1, win 2048, length 0
09:58:47.940540 IP 10.49.3.156.62572 > 10.104.232.131.sstp-2: Flags [.], ack 1, win 2048, length 0
09:58:48.160650 IP 10.49.3.156.62582 > 10.104.232.131.sstp-2: Flags [.], ack 1, win 2048, length 0
09:58:48.161893 IP 10.49.3.156.62581 > 10.104.232.131.sstp-2: Flags [.], ack 1, win 2048, length 0
09:58:48.161937 IP 10.49.3.156.62578 > 10.104.232.131.sstp-2: Flags [.], ack 1, win 2048, length 0
09:58:48.161942 IP 10.49.3.156.62573 > 10.104.232.131.sstp-2: Flags [.], ack 1, win 2048, length 0
09:58:48.163112 IP 10.49.3.156.62579 > 10.104.232.131.sstp-2: Flags [.], ack 1, win 2048, length 0
09:58:48.379173 IP 10.49.3.156.62580 > 10.104.232.131.sstp-2: Flags [.], ack 1, win 2048, length 0
09:58:52.287412 IP 10.49.3.156.62575 > 10.104.232.131.sstp-2: Flags [.], ack 1, win 2048, length 0
09:59:33.737026 IP 10.49.3.156.62577 > 10.104.232.131.sstp-2: Flags [.], ack 1, win 2048, length 0
09:59:33.737069 IP 10.49.3.156.62576 > 10.104.232.131.sstp-2: Flags [.], ack 1, win 2048, length 0
09:59:33.7370
```
Thanks for your reply!

**Comment by phantomedc** [comment]
i found it may related to the loadbalance device,
when i connect to the nginx directly, 
![image](https://user-images.githubusercontent.com/15801693/64512207-79580c00-d318-11e9-8c02-914f1eca1fd5.png)
reactor-netty will receive a FIN flag after being idle for a while(15 seconds in my case):
```
2019-09-09 15:17:29.110 [reactor-http-kqueue-8] DEBUG reactor.netty.resources.PooledConnectionProvider - [id: 0xaa7d195c, L:/10.49.3.156:60372 ! R:10.47.197.7/10.47.197.7:9800] Channel closed, now 0 active connections and 0 inactive connections
2019-09-09 15:17:29.110 [reactor-http-kqueue-8] DEBUG reactor.netty.resources.PooledConnectionProvider - [id: 0xaa7d195c, L:/10.49.3.156:60372 ! R:10.47.197.7/10.47.197.7:9800] onStateChange(PooledConnection{channel=[id: 0xaa7d195c, L:/10.49.3.156:60372 ! R:10.47.197.7/10.47.197.7:9800]}, [disconnecting])
```
```
15:03:05.186286 IP 10.47.197.7.davsrc > 10.49.3.156.59958: Flags [F.], seq 440, ack 523, win 122, options [nop,nop,TS val 3454765281 ecr 403782755], length 0
15:03:05.186345 IP 10.49.3.156.59958 > 10.47.197.7.davsrc: Flags [.], ack 441, win 2052, options [nop,nop,TS val 403797490 ecr 3454765281], length 0
15:03:05.186492 IP 10.49.3.156.59958 > 10.47.197.7.davsrc: Flags [F.], seq 523, ack 441, win 2052, options [nop,nop,TS val 403797490 ecr 3454765281], length 0
15:03:05.186803 IP 10.47.197.7.davsrc > 10.49.3.156.59958: Flags [.], ack 524, win 122, options [nop,nop,TS val 3454765282 ecr 403797490], length 0
```
but when the whole link is:
![image](https://user-images.githubusercontent.com/15801693/64512165-5ded0100-d318-11e9-8527-dc588eec20a8.png)
reactor-netty won't receive a FIN flag from remote side, so the connection won't be handled, until the next request comming, just like the tcpdump log in my last comment.

**Comment by violetagg** [comment]
@phantomedc If we do not receive FIN for us this connection is still alive. Then the ReadTimeoutHandler will close it because of the timeout.

**Comment by phantomedc** [comment]
> @phantomedc If we do not receive FIN for us this connection is still alive. Then the ReadTimeoutHandler will close it because of the timeout.

yes, it seems not reactor netty's bug, i'm gonna close this issue

**Comment by gearora** [comment]
@phantomedc What solution did you implement to solve the timeouts then?

**Comment by benweet** [comment]
Using kotlin coroutines with spring boot 2.2, I had this typical issue because the netty server and the webclient were sharing the same event loop, which caused the server to hang under heavy load as all the workers were used by one or the other (only 4 threads by default if server cpu <= 4).

The fix was to use another event loop for all the webclients, keeping the main one dedicated to handling the server requests:

```java
ReactorClientHttpConnector sharedConnector = new ReactorClientHttpConnector(
    HttpClient.create().runOn(LoopResources.create("reactor-webclient")
)
```

**Comment by phantomedc** [comment]
> @phantomedc What solution did you implement to solve the timeouts then?

it is my loadbalancing device's problem, i change it from http to tcp to disable connections  reusing

**Comment by asarkar** [comment]
@benweet With 0.9.8.RELEASE, there's no `runOn` method on the `HttpClient`.

**Comment by koenpunt** [comment]
> The fix was to use another event loop for all the webclients, keeping the main one dedicated to handling the server requests:

This does seem to work, but can maybe someone from the Netty or Spring team confirm that this is the recommended approach?

**Comment by skumaridas10** [comment]
What’s the fix for this. Facing same issue read timeout.

**Comment by violetagg** [comment]
@skumaridas10 As @phantomedc described above it was an issue with the load balancer.
Please check this FAQ https://projectreactor.io/docs/netty/release/reference/index.html#faq.connection-closed, the section `Check for any proxies and load balancers`
